title,url,thumbnail_url,channel,description
Jake Paul Scores Insane KO of Tyron Woodley In Round 6 | SHOWTIME PPV,https://www.youtube.com/watch?v=1xzYLkxjdag,https://i.ytimg.com/vi/1xzYLkxjdag/hqdefault.jpg?sqp=-oaymwEcCPYBEIoBSFXyq4qpAw4IARUAAIhCGAFwAcABBg==&rs=AOn4CLAUB8FxpdmiP-EZDSHkk4kqoxZEnA,SHOWTIME Sports,International superstar Jake “The Problem Child” Paul left no doubt in his rematch with former MMA champ Tyron Woodley scoring an insane KO of Woodley in round 6. #ShowtimePPV #JakePaul...
"Extreme $1,000,000 Hide And Seek",https://www.youtube.com/watch?v=00NgUctWoLQ,https://i.ytimg.com/vi/00NgUctWoLQ/hqdefault.jpg?sqp=-oaymwEcCPYBEIoBSFXyq4qpAw4IARUAAIhCGAFwAcABBg==&rs=AOn4CLD8yf2kcBKx68yUZdyNDy5a4Tk25w,MrBeast,I didn't expect that to happen at the end I was so confused haha ╔═╦╗╔╦╗╔═╦═╦╦╦╦╗╔═╗ ║╚╣║║║╚╣╚╣╔╣╔╣║╚╣═╣ ╠╗║╚...
Five Nights at Freddy's: Security Breach - Part 2,https://www.youtube.com/watch?v=jpaOFkOqmvY,https://i.ytimg.com/vi/jpaOFkOqmvY/hqdefault.jpg?sqp=-oaymwEcCPYBEIoBSFXyq4qpAw4IARUAAIhCGAFwAcABBg==&rs=AOn4CLDoE-rxqMLM8YIJg6tnVB20TbaliQ,Markiplier,Who is Vanessa? Who is Vanny? Who is the bunny in Security Breach? My Comfiest Clothes Yet ► https://cloakbrand.com/ LISTEN TO DISTRACTIBLE ►► https://podlink.to/distractiblepodcast ...
Jake Paul KNOCKS OUT Tyron Woodley in Rematch [Highlights + Recap] | CBS Sports HQ,https://www.youtube.com/watch?v=LDlfkXT3_XQ,,CBS Sports HQ,Brian Campbell joins CBS Sports HQ to break down Jake Paul vs Tyron Woodley 2! For more extensive fight coverage and on-site reaction head to @Morning Kombat and Subscribe! SUBSCRIBE TO OUR...
Jake Paul & Tyron Woodley SQUASH BEEF after Rematch Fight,https://www.youtube.com/watch?v=7sEhfymFsNg,,SecondsOut,Subscribe for updates - http://goo.gl/meA2GB Follow on Twitter: http://goo.gl/VDYVMP Like on Facebook: https://www.facebook.com/secondsoutlive SecondsOut is a world leader in boxing entertainment...
Five Nights at Freddy's: Security Breach - Part 1,https://www.youtube.com/watch?v=ClQ-ymoXJZc,,Markiplier,Security Breach is HERE!! What horrors lurk in an official free roam Five Nights at Freddy's game? My Comfiest Clothes Yet ► https://cloakbrand.com/ LISTEN TO DISTRACTIBLE ►► https://podlink....
Love or Play Station? #shorts,https://www.youtube.com/shorts/-Ca8V1-ihq0,,PANDA BOI,New mix of my funny and entertaining videos. Follow me on other platforms for more funny videos: Instagram : https://www.instagram.com/pandaboi.com_/ Tiktok : https://www.tiktok.com/@pandaboi.com...
John Wick vs John Rambo vs John McClane. Epic Rap Battles Of History,https://www.youtube.com/watch?v=LN5lzg3TE60,,ERB,John Wick vs John Rambo vs John McClane. Epic Rap Battles Of History. Special thanks as ever to all of our wonderful patrons. To join our ERB crew for just $5 a month go to: http://www.patreon.com...
REAL LIFE EXORCISM: A Documentary - JonTron,https://www.youtube.com/watch?v=tlygSuwNcsg,,JonTronShow,"Thanks Lords Mobile for sponsoring, download now for a chance to win prizes here: https://www.igg.com/event/jontron Tons of prizes are being given away totaling $10,000 and a $350 gift pack..."
Minecraft But I Have VIDEO GAME Hearts!,https://www.youtube.com/watch?v=bqZkpjtxArU,,PrestonPlayz,Minecraft But I Have VIDEO GAME Hearts! with PrestonPlayz 👊 👕 MERCH - http://www.firemerch.com 👀 FOLLOW ME HERE! 🡆 TikTok - https://www.tiktok.com/@preston 🡆 Instagram - https://i...
